{
  "legal_name": "Example Issuer EOOD",
  "address": {
    "line1": "Musterstraße 1",
    "postal_code": "9000",
    "city": "Varna",
    "country_code": "BG"
  },
  "tax_id": "000000000",
  "vat_id": "BG000000000",
  "bank": {
    "name": "Example Bank",
    "iban": "DE89370400440532013000",
    "bic": "COBADEFFXXX"
  },
  "logo": "static/logo.svg",
  "default_currency": "EUR"
}
